<?xml version="1.0" encoding="UTF-8"?>
<?xml-stylesheet title="Dictionary view" media="screen,tv,projection" href="../../scripts/gt_dictionary.css" type="text/css"?>
<?xml-stylesheet alternate="yes" title="Hierarchical view" media="screen,tv,projection" href="../../scripts/gt_dictionary_alt.css" type="text/css"?>
<!DOCTYPE r PUBLIC "-//DivvunGiellatekno//DTD Dictionaries//Multilingual" "../scripts/dict_finnob.dtd">
<r id="finnob" xml:lang="fin">
   <lics>
      <lic xml:lang="en">
This code is made available under a Creative Commons Attribution license
<a>http://creativecommons.org/licenses/by/3.0/no/deed.en</a>.

You are free to copy, distribute and adapt the work, as long as you always give
proper attribution using the attribution text below.

For the full license text, see the link above.</lic>
      <ref>Work by Giellatekno at UiT
          and members of the language community. Source code
          available at <a>https://victorio.uit.no/langtech/trunk/</a>.</ref>
      <sourcenote>
     THIS TEXT IS THE ORIGINAL SOURCE CODE. This is NOT a fully styled and
     published dictionary. As such it can and
     will contain unfinished entries, unpublished entries, entries with
     objectionable translations, etc. If you find any errors or want to add more
     words, download the file, edit it, and send it back to
     <a>mailto:divvun@samediggi.no</a> and <a>mailto:giellatekno@hum.uit.no</a>.
     Please also note that the entries are not necessarily sorted,
     or could be wrongly sorted.
     </sourcenote>
   </lics>
   <e>
      <lg>
         <l pos="CC">kun</l>
      </lg>
      <mg>
         <tg xml:lang="nob">
            <t pos="CC">da</t>
            <t pos="CC">når</t>
         </tg>
      </mg>
      <mg>
         <tg xml:lang="nob">
            <t pos="CC">enn</t>
         </tg>
      </mg>
   </e>
   <e>
      <lg>
         <l pos="CC">jos</l>
      </lg>
      <mg>
         <tg xml:lang="nob">
            <t pos="CC">hvis</t>
            <t pos="CC">om</t>
         </tg>
      </mg>
   </e>
   <e>
      <lg>
         <l pos="CC">eli</l>
      </lg>
      <mg>
         <tg xml:lang="nob">
            <t pos="CC">eller</t>
         </tg>
      </mg>
   </e>
   <e>
      <lg>
         <l pos="CC">ja</l>
      </lg>
      <mg>
         <tg xml:lang="nob">
            <t pos="CC">samt</t>
            <t pos="CC">og</t>
         </tg>
      </mg>
   </e>
   <e>
      <lg>
         <l pos="CC">joko ... tai</l>
      </lg>
      <mg>
         <tg xml:lang="nob">
            <t pos="CC">enten ... eller</t>
         </tg>
      </mg>
   </e>
   <e>
      <lg>
         <l pos="CC">mutta</l>
      </lg>
      <mg>
         <tg xml:lang="nob">
            <t pos="CC">men</t>
         </tg>
      </mg>
   </e>
   <e>
      <lg>
         <l pos="CC">tai</l>
      </lg>
      <mg>
         <tg xml:lang="nob">
            <t pos="CC">eller</t>
         </tg>
      </mg>
   </e>
   <e>
      <lg>
         <l pos="CC">tai</l>
      </lg>
      <mg>
         <tg xml:lang="nob">
            <t pos="CC">eller</t>
         </tg>
      </mg>
   </e>
   <e>
      <lg>
         <l pos="CC">vai</l>
      </lg>
      <mg>
         <tg xml:lang="nob">
            <t pos="CC">eller</t>
         </tg>
      </mg>
   </e>
   <e>
      <lg>
         <l pos="CC">vaikka</l>
      </lg>
      <mg>
         <tg xml:lang="nob">
            <t pos="CC">selv om</t>
         </tg>
      </mg>
   </e>
   <e src="ai">
      <lg>
         <l pos="CC">vain</l>
      </lg>
      <mg>
         <tg xml:lang="nob" re="i spørsmål">
            <t pos="CC">eller</t>
         </tg>
      </mg>
   </e>
</r>
